inst/extdata/dtu_table.tsv

tx_id	gene_id	gene_name	estimate	padj
ENSMUST00000020248.16	ENSMUSG00000020056.17	Washc3	-0.2647158522549933	0.044963357396544314
ENSMUST00000182183.8	ENSMUSG00000020056.17	Washc3	9.190591132286231	0.08673757636421714
ENSMUST00000020397.11	ENSMUSG00000020180.11	Snrpd3	-0.05241036962608755	0.02342004555943689
ENSMUST00000191097.2	ENSMUSG00000020180.11	Snrpd3	3.1692504246940025	0.34683459823872226
ENSMUST00000021347.12	ENSMUSG00000020964.15	Sel1l	-3.2853519254792336	0.0017193449317794976
ENSMUST00000178462.8	ENSMUSG00000020964.15	Sel1l	2.993838276569464	0.0017193449317794976
ENSMUST00000065504.17	ENSMUSG00000021814.18	Anxa7	-3.3489400257093918	4.736254203510072e-4
ENSMUST00000100844.6	ENSMUSG00000021814.18	Anxa7	3.0240598857622607	0.018472554078266316
ENSMUST00000224975.2	ENSMUSG00000021814.18	Anxa7	7.1106831335345	1
ENSMUST00000226001.2	ENSMUSG00000021814.18	Anxa7	-3.511853155046318	1
ENSMUST00000027877.7	ENSMUSG00000026585.14	Kifap3	-1.7070771859956106	0.08819639911678721
ENSMUST00000077642.12	ENSMUSG00000026585.14	Kifap3	1.0438853580951457	0.010395184684240402
ENSMUST00000034281.13	ENSMUSG00000031824.16	6430548M08Rik	4.1422956080474185	9.950410257349939e-4
ENSMUST00000108951.8	ENSMUSG00000031824.16	6430548M08Rik	-3.4275926040413403	3.410005627106369e-4
ENSMUST00000212268.2	ENSMUSG00000031824.16	6430548M08Rik	-2.9552131819392176	1
ENSMUST00000166232.4	ENSMUSG00000031955.11	Bcar1	-3.477749241276865	0.025976163941104996
ENSMUST00000212349.2	ENSMUSG00000031955.11	Bcar1	3.8565912575090326	0.02700940514433338
ENSMUST00000030254.15	ENSMUSG00000035212.15	Leprot	-2.405393583622286	0.018472554078266316
ENSMUST00000106927.2	ENSMUSG00000035212.15	Leprot	9.130546031439705	0.018472554078266316
ENSMUST00000028220.10	ENSMUSG00000035949.16	Fbxw2	-2.9028935377073664	0.3151311909952268
ENSMUST00000113078.8	ENSMUSG00000035949.16	Fbxw2	3.339980224904238	0.04279142928736781
ENSMUST00000113080.9	ENSMUSG00000035949.16	Fbxw2	-5.964024612265343	1
ENSMUST00000131534.8	ENSMUSG00000035949.16	Fbxw2	0.3954530677607705	1
ENSMUST00000156130.2	ENSMUSG00000035949.16	Fbxw2	0.7822509978594383	1
ENSMUST00000046371.13	ENSMUSG00000040563.14	Plppr2	-0.6940103292866237	7.301077998566399e-4
ENSMUST00000190387.7	ENSMUSG00000040563.14	Plppr2	6.3367147451970744	0.006078233743132377
ENSMUST00000012612.11	ENSMUSG00000041164.16	Zmiz2	-3.209763811174845	0.008121717884457036
ENSMUST00000102914.10	ENSMUSG00000041164.16	Zmiz2	0.684080774624406	1
ENSMUST00000109785.2	ENSMUSG00000041164.16	Zmiz2	-0.6191029729922538	1
ENSMUST00000109786.8	ENSMUSG00000041164.16	Zmiz2	-2.0522794899066827	1
ENSMUST00000109787.8	ENSMUSG00000041164.16	Zmiz2	4.6608336543514595	0.04284632447087677
ENSMUST00000077128.13	ENSMUSG00000041225.17	Arhgap12	-8.096839396766285	1
ENSMUST00000182038.2	ENSMUSG00000041225.17	Arhgap12	-5.5025565826333445	1
ENSMUST00000182066.8	ENSMUSG00000041225.17	Arhgap12	2.7724915526970553	0.035517571734601405
ENSMUST00000182213.8	ENSMUSG00000041225.17	Arhgap12	-3.7524591441682635	1
ENSMUST00000182559.8	ENSMUSG00000041225.17	Arhgap12	-1.7456976580969537	1
ENSMUST00000086693.12	ENSMUSG00000052105.18	Mtcl1	2.8852362286915727	0.013967131875976002
ENSMUST00000097291.10	ENSMUSG00000052105.18	Mtcl1	-2.973204282907383	0.009701212578721636
ENSMUST00000134139.8	ENSMUSG00000052105.18	Mtcl1	2.4926042053959185	1
ENSMUST00000047321.9	ENSMUSG00000055116.9	Bmal1	-1.56845329347391	0.04279142928736781
ENSMUST00000210074.2	ENSMUSG00000055116.9	Bmal1	3.1471410833446516	0.14453992305672328
ENSMUST00000210238.2	ENSMUSG00000055116.9	Bmal1	2.3154910224716354	0.8019663473929202
ENSMUST00000211770.2	ENSMUSG00000055116.9	Bmal1	-1.1549680854347248	1
ENSMUST00000072580.12	ENSMUSG00000062044.17	Lmtk3	0.4863586911312544	1
ENSMUST00000120005.10	ENSMUSG00000062044.17	Lmtk3	3.3153421803422205	0.04279142928736781
ENSMUST00000209617.2	ENSMUSG00000062044.17	Lmtk3	-1.5894376707350273	0.17169806764899875
ENSMUST00000233503.2	ENSMUSG00000062044.17	Lmtk3	0.7786865713201087	1
ENSMUST00000093209.4	ENSMUSG00000069919.8	Hba-a1	0.37702258602893723	0.0017193449317794976
ENSMUST00000142555.2	ENSMUSG00000069919.8	Hba-a1	2.1422164192430846	0.5194827124613101

articles/splicelogic.md

## GRanges object with 1 range and 11 metadata columns:

##       seqnames            ranges strand |   exon_id            exon_name
    ##          <Rle>         <IRanges>  <Rle> | <numeric>          <character>
    ##   [1]    chr17 66647479-66647535      - |    480827 ENSMUSE00000443570.7
    ##       exon_rank                 tx_id               gene_id   gene_name
    ##       <numeric>           <character>           <character> <character>
    ##   [1]        14 ENSMUST00000097291.10 ENSMUSG00000052105.18       Mtcl1
    ##        estimate       padj  event_type           event_tx_id event_estimate
    ##       <numeric>  <numeric> <character>           <character>      <numeric>
    ##   [1]   -2.9732 0.00970121          se ENSMUST00000086693.12        2.88524
    ##   -------
    ##   seqinfo: 61 sequences (1 circular) from mm39 genome

## GRanges object with 3 ranges and 11 metadata columns:

##       seqnames              ranges strand |   exon_id            exon_name
    ##          <Rle>           <IRanges>  <Rle> | <numeric>          <character>
    ##   [1]    chr14   20517526-20517591      - |    408079 ENSMUSE00001423050.2
    ##   [2]     chr1 163739641-163739706      + |     12966 ENSMUSE00000368805.4
    ##   [3]     chr8 120884207-120884236      + |    250989 ENSMUSE00001243257.2
    ##       exon_rank                 tx_id               gene_id     gene_name
    ##       <numeric>           <character>           <character>   <character>
    ##   [1]         6  ENSMUST00000100844.6 ENSMUSG00000021814.18         Anxa7
    ##   [2]        20 ENSMUST00000077642.12 ENSMUSG00000026585.14        Kifap3
    ##   [3]        10 ENSMUST00000034281.13 ENSMUSG00000031824.16 6430548M08Rik
    ##        estimate        padj  event_type           event_tx_id event_estimate
    ##       <numeric>   <numeric> <character>           <character>      <numeric>
    ##   [1]   3.02406 0.018472554          ie ENSMUST00000065504.17       -3.34894
    ##   [2]   1.04389 0.010395185          ie  ENSMUST00000027877.7       -1.70708
    ##   [3]   4.14230 0.000995041          ie  ENSMUST00000108951.8       -3.42759
    ##   -------
    ##   seqinfo: 61 sequences (1 circular) from mm39 genome

## GRanges object with 2 ranges and 11 metadata columns:

##       seqnames            ranges strand |   exon_id            exon_name
    ##          <Rle>         <IRanges>  <Rle> | <numeric>          <character>
    ##   [1]    chr12 91799829-91799996      - |    374021 ENSMUSE00001304078.2
    ##   [2]    chr12 91798541-91798558      - |    374018 ENSMUSE00001473756.2
    ##       exon_rank                 tx_id               gene_id   gene_name
    ##       <numeric>           <character>           <character> <character>
    ##   [1]         4 ENSMUST00000021347.12 ENSMUSG00000020964.15       Sel1l
    ##   [2]         4  ENSMUST00000178462.8 ENSMUSG00000020964.15       Sel1l
    ##        estimate       padj  event_type           event_tx_id event_estimate
    ##       <numeric>  <numeric> <character>           <character>      <numeric>
    ##   [1]  -3.28535 0.00171934         mxe  ENSMUST00000178462.8        2.99384
    ##   [2]   2.99384 0.00171934         mxe ENSMUST00000021347.12       -3.28535
    ##   -------
    ##   seqinfo: 61 sequences (1 circular) from mm39 genome

## GRanges object with 1 range and 11 metadata columns:

##       seqnames            ranges strand |   exon_id            exon_name
    ##          <Rle>         <IRanges>  <Rle> | <numeric>          <character>
    ##   [1]     chr9 21858242-21858348      + |    266133 ENSMUSE00001322549.2
    ##       exon_rank                tx_id               gene_id   gene_name
    ##       <numeric>          <character>           <character> <character>
    ##   [1]         7 ENSMUST00000190387.7 ENSMUSG00000040563.14      Plppr2
    ##        estimate       padj  event_type           event_tx_id event_estimate
    ##       <numeric>  <numeric> <character>           <character>      <numeric>
    ##   [1]   6.33671 0.00607823        a5ss ENSMUST00000046371.13       -0.69401
    ##   -------
    ##   seqinfo: 61 sequences (1 circular) from mm39 genome

## GRanges object with 22 ranges and 11 metadata columns:

##        seqnames              ranges strand |   exon_id            exon_name
    ##           <Rle>           <IRanges>  <Rle> | <numeric>          <character>
    ##    [1]    chr17   66647479-66647535      - |    480827 ENSMUSE00000443570.7
    ##    [2]    chr14   20517526-20517591      - |    408079 ENSMUSE00001423050.2
    ##    [3]     chr1 163739641-163739706      + |     12966 ENSMUSE00000368805.4
    ##    [4]     chr8 120884207-120884236      + |    250989 ENSMUSE00001243257.2
    ##    [5]    chr12   91799829-91799996      - |    374021 ENSMUSE00001304078.2
    ##    ...      ...                 ...    ... .       ...                  ...
    ##   [18]    chr14   20505329-20506669      - |    408059 ENSMUSE00000564348.6
    ##   [19]     chr8 120887954-120892045      + |    250998 ENSMUSE00000446870.6
    ##   [20]     chr8 112437109-112438026      - |    262490 ENSMUSE00001391518.2
    ##   [21]     chr9   21858900-21860203      + |    266139 ENSMUSE00001327764.2
    ##   [22]    chr17   66643977-66645149      - |    480823 ENSMUSE00000791759.2
    ##        exon_rank                 tx_id               gene_id     gene_name
    ##        <numeric>           <character>           <character>   <character>
    ##    [1]        14 ENSMUST00000097291.10 ENSMUSG00000052105.18         Mtcl1
    ##    [2]         6  ENSMUST00000100844.6 ENSMUSG00000021814.18         Anxa7
    ##    [3]        20 ENSMUST00000077642.12 ENSMUSG00000026585.14        Kifap3
    ##    [4]        10 ENSMUST00000034281.13 ENSMUSG00000031824.16 6430548M08Rik
    ##    [5]         4 ENSMUST00000021347.12 ENSMUSG00000020964.15         Sel1l
    ##    ...       ...                   ...                   ...           ...
    ##   [18]        14  ENSMUST00000100844.6 ENSMUSG00000021814.18         Anxa7
    ##   [19]        13 ENSMUST00000034281.13 ENSMUSG00000031824.16 6430548M08Rik
    ##   [20]         7  ENSMUST00000212349.2 ENSMUSG00000031955.11         Bcar1
    ##   [21]         9  ENSMUST00000190387.7 ENSMUSG00000040563.14        Plppr2
    ##   [22]        14 ENSMUST00000086693.12 ENSMUSG00000052105.18         Mtcl1
    ##         estimate        padj  event_type           event_tx_id event_estimate
    ##        <numeric>   <numeric> <character>           <character>      <numeric>
    ##    [1]  -2.97320 0.009701213          se ENSMUST00000086693.12        2.88524
    ##    [2]   3.02406 0.018472554          ie ENSMUST00000065504.17       -3.34894
    ##    [3]   1.04389 0.010395185          ie  ENSMUST00000027877.7       -1.70708
    ##    [4]   4.14230 0.000995041          ie  ENSMUST00000108951.8       -3.42759
    ##    [5]  -3.28535 0.001719345         mxe  ENSMUST00000178462.8        2.99384
    ##    ...       ...         ...         ...                   ...            ...
    ##   [18]   3.02406 0.018472554        ates ENSMUST00000065504.17       -3.34894
    ##   [19]   4.14230 0.000995041        ates  ENSMUST00000108951.8       -3.42759
    ##   [20]   3.85659 0.027009405        ates  ENSMUST00000166232.4       -3.47775
    ##   [21]   6.33671 0.006078234        ates ENSMUST00000046371.13       -0.69401
    ##   [22]   2.88524 0.013967132        ates ENSMUST00000097291.10       -2.97320
    ##   -------
    ##   seqinfo: 61 sequences (1 circular) from mm39 genome